{
  "assets": [
    {
      "archiveRoot": "AI-Video-Channel-Production-Unified-Installer-v0.12.0-rc.3",
      "assetId": "unified-installer",
      "compatibleProductVersions": [
        "0.12.0-rc.3"
      ],
      "fileName": "AI-Video-Channel-Production-Unified-Installer-v0.12.0-rc.3.zip",
      "install": false,
      "installSubpath": "",
      "license": {
        "expression": "LicenseRef-AI-Video-Channel-Production-1.0",
        "reviewStatus": "product-license-applies",
        "source": "LICENSE.md"
      },
      "sha256": "311c580afa9ab3b5791634fe6fde19c2f322b502dbef54d0e63063ef03912387",
      "sizeBytes": 16247,
      "source": {
        "commit": "LOCAL_COMMIT_TO_BE_RECORDED",
        "repository": "https://github.com/coisu772-code/AI-/"
      },
      "version": "0.12.0-rc.3"
    },
    {
      "archiveRoot": "ai-video-channel-production-core",
      "assetId": "core",
      "compatibleProductVersions": [
        "0.12.0-rc.3"
      ],
      "fileName": "ai-video-channel-production-core-v0.12.0-rc.3-windows.zip",
      "install": true,
      "installSubpath": "",
      "license": {
        "expression": "LicenseRef-AI-Video-Channel-Production-1.0",
        "reviewStatus": "product-license-applies",
        "source": "LICENSE.md"
      },
      "sha256": "97b4c5a8cabc7772d3ffdd5884847f8491cbf1ddd4ff1f2f71d8794ce2ad5231",
      "sizeBytes": 648298,
      "source": {
        "commit": "LOCAL_COMMIT_TO_BE_RECORDED",
        "repository": "https://github.com/coisu772-code/AI-/"
      },
      "version": "0.12.0-rc.3"
    },
    {
      "archiveRoot": "aivcp-python-runtime-3.12.13",
      "assetId": "python-runtime",
      "compatibleProductVersions": [
        "0.12.0-rc.3"
      ],
      "fileName": "aivcp-python-runtime-3.12.13-windows-x64.zip",
      "install": true,
      "installSubpath": "runtime/python",
      "license": {
        "expression": "PSF-2.0 AND bundled-third-party-licenses AND MIT",
        "reviewStatus": "technical-inventory-validated-release-owner-approval-required",
        "source": "LICENSE.txt plus 72 license entries covering 23 packages and the bundled Deno runtime"
      },
      "sha256": "c0287164afd7b2c764de2f740e4bdaf07293982d69bc86f507850e7dfdab3ea6",
      "sizeBytes": 72882128,
      "source": {
        "build": "20260610",
        "bundledTools": [
          {
            "license": {
              "expression": "MIT",
              "path": "tools/licenses/deno-LICENSE.md",
              "sha256": "f62497fffecc0852960c8d3e6934b9db86d16396e9b604072e923892cae3a588"
            },
            "relativePath": "tools/deno.exe",
            "sha256": "4a2757fe99afc2c62c46500c8221cfa0189ac4bfb7064141875ad9c0f04b60ef",
            "sizeBytes": 97175328,
            "source": {
              "archiveSha256": "68ed08b05c56cf887e9aa509947dc3f468f7e12f47a13e5c1abd51d46d1453ef",
              "url": "https://github.com/denoland/deno/releases/download/v2.9.4/deno-x86_64-pc-windows-msvc.zip"
            },
            "toolId": "deno",
            "version": "2.9.4"
          }
        ],
        "technicalLicenseInventory": {
          "legalAdviceOrSignoff": false,
          "licenseEntryCount": 72,
          "missingDeclaredLicense": [],
          "missingLicenseFile": [],
          "packageCount": 23,
          "reviewRequired": 0,
          "status": "TECHNICALLY_VALIDATED_LEGAL_APPROVAL_REQUIRED"
        },
        "url": "https://github.com/astral-sh/python-build-standalone"
      },
      "version": "3.12.13"
    },
    {
      "archiveRoot": "Z-Manga-Workshop-2.5.0-rc.3-for-AIVCP-0.12.0-rc.3-windows-x64-portable",
      "assetId": "workshop",
      "compatibleProductVersions": [
        "0.12.0-rc.3"
      ],
      "fileName": "Z-Manga-Workshop-2.5.0-rc.3-for-AIVCP-0.12.0-rc.3-windows-x64-portable.zip",
      "install": true,
      "installSubpath": "apps/workshop",
      "license": {
        "expression": "LicenseRef-AIVCP-Workshop AND GPL-3.0-only",
        "reviewStatus": "technical-inventory-validated-release-owner-approval-required",
        "source": "licenses/application/LICENSE.md, licenses/ffmpeg/COPYING.GPLv3 and FFMPEG-PROVENANCE.txt inside archive"
      },
      "sha256": "c0cfc4e99cded633c1df9739c9b15a29f59c74d01d1b1be1df906a217d1337d3",
      "sizeBytes": 157490577,
      "source": {
        "acceptanceStatus": "LOCAL_MERGED_ACCEPTANCE_PASS",
        "commit": "ce7884cc2fa9c06d8733014db5d6ba4dca156819"
      },
      "version": "2.5.0-rc.3"
    },
    {
      "archiveRoot": "youtube-publisher-center-v0.9.0-rc.2-windows-amd64",
      "assetId": "publisher-center",
      "compatibleProductVersions": [
        "0.12.0-rc.3"
      ],
      "fileName": "youtube-publisher-center-v0.9.0-rc.2-windows-amd64.zip",
      "install": true,
      "installSubpath": "apps/publisher",
      "license": {
        "expression": "LicenseRef-AI-Video-Channel-Production-1.0 AND bundled-third-party-licenses",
        "reviewStatus": "technical-inventory-validated-release-owner-approval-required",
        "source": "LICENSE.md, THIRD-PARTY-NOTICES.json/.md and 101 third-party license texts inside archive"
      },
      "sha256": "ef85eb6edaee360f6d404695e53b0cce0f12a8b9de53fd161beb239f89a4e810",
      "sizeBytes": 32682677,
      "source": {
        "acceptanceStatus": "LOCAL_FORMAL_HANDOFF_AND_OFFLINE_SAFETY_PASS",
        "commit": "00adafe9fa6b358991616793d545e0ef0def9ee9",
        "componentManifest": {
          "fileName": "publisher-component-manifest-v0.9.0-rc.2.json",
          "sha256": "f72626579dc4fd4cd3e8a52a75266209469d99cdf37b2f9b815f25c9ada36748"
        },
        "constraintsCatalog": {
          "normalization": "CRLF_AND_CR_TO_LF_BEFORE_SHA256",
          "sha256": "28788480458f37ba86584b4c63e0ef998081ac521ecd9fd0b1724c2a6074b99a",
          "version": "2026.08.04.1"
        },
        "fileEntries": 112,
        "licenseReviewRequired": 0,
        "snapshotSha256": "fc7afcd4ca1b053d36363c22f11130383c35e4422eab270b06ed1fb736c50c98"
      },
      "version": "0.9.0-rc.2"
    }
  ],
  "downloadBaseUrl": "https://github.com/coisu772-code/AI-/releases/download/v0.12.0-rc.3",
  "generatedAt": "2026-08-18T00:00:00Z",
  "hashAlgorithm": "SHA-256",
  "logicalComponents": [
    {
      "componentId": "ffmpeg-runtime",
      "files": [
        {
          "relativeInstallPath": "apps/workshop/tools/ffmpeg/bin/ffmpeg.exe",
          "sha256": "1326dde4c84ff1f96fe6b8916c5bed29e163e9b5dccf995f6f3db069d143ec5e",
          "sizeBytes": 101897728
        },
        {
          "relativeInstallPath": "apps/workshop/tools/ffmpeg/bin/ffprobe.exe",
          "sha256": "b49ccc7c6547b141ad5a2f6ec69cc04323d7133d7704d70b331b904c63eecb07",
          "sizeBytes": 101692928
        }
      ],
      "healthCheck": {
        "command": "apps/workshop/tools/ffmpeg/bin/ffmpeg.exe -version",
        "expected": "ffmpeg version 8.1.2"
      },
      "license": {
        "expression": "GPL-3.0-only",
        "source": "apps/workshop/licenses/ffmpeg/COPYING.GPLv3 and FFMPEG-PROVENANCE.txt"
      },
      "providedByAsset": "workshop",
      "version": "8.1.2"
    }
  ],
  "optionalRuntimePackages": [
    {
      "archive": {
        "fileName": "Z-Manga-Studio-kokoro-runtime-cpu.zip",
        "sha256": "2dfeea06b277dabf963825b33cea74e2dae8f6444c159e1803ecd08fe4be4960"
      },
      "license": {
        "expression": "Apache-2.0 AND bundled-third-party-licenses",
        "reviewStatus": "technical-inventory-validated-release-owner-approval-required",
        "source": "LICENSE-Kokoro-FastAPI.txt and THIRD_PARTY_NOTICES.txt inside the assembled runtime archive"
      },
      "manifest": {
        "fileName": "Z-Manga-Studio-kokoro-runtime-cpu.json",
        "sha256": "c5b024ba7991518d5400d849a6778b3d75f14808a31b8679dd7c2ef8591d5dca",
        "sizeBytes": 673
      },
      "parts": [
        {
          "fileName": "Z-Manga-Studio-kokoro-runtime-cpu.zip.001",
          "sha256": "2dfeea06b277dabf963825b33cea74e2dae8f6444c159e1803ecd08fe4be4960",
          "sizeBytes": 1368460413
        }
      ],
      "runtimeId": "kokoro-fastapi",
      "runtimeVersion": "0.5.0",
      "source": {
        "packager": "scripts/package-kokoro-runtime.ps1",
        "releaseManifest": {
          "fileName": "unified-release-v0.10.0-rc.1.json",
          "sha256": "a145f756030e4b8c630031906352d42b3ab5212aba353708d1a045730bd2af5d"
        },
        "releaseTag": "v0.10.0-rc.1",
        "repository": "coisu772-code/AI-",
        "reuseStatus": "PUBLISHED_RUNTIME_REUSED_AFTER_REMOTE_DIGEST_REVALIDATION",
        "workshopCommit": "343c064a7d73cb5aa68a09d973d93a8fca57c4bb"
      },
      "variant": "cpu"
    },
    {
      "archive": {
        "fileName": "Z-Manga-Studio-kokoro-runtime-nvidia.zip",
        "sha256": "1559bcbdbd8f6f9d4e14cb2f91f37fb981bcd2ac7c57548655b28c02e5ecacce"
      },
      "license": {
        "expression": "Apache-2.0 AND bundled-third-party-licenses",
        "reviewStatus": "technical-inventory-validated-release-owner-approval-required",
        "source": "LICENSE-Kokoro-FastAPI.txt and THIRD_PARTY_NOTICES.txt inside the assembled runtime archive"
      },
      "manifest": {
        "fileName": "Z-Manga-Studio-kokoro-runtime-nvidia.json",
        "sha256": "943732e0133e3bf09ca3fd0e901531fdeed388c93b15144128dc7db82c0769fb",
        "sizeBytes": 950
      },
      "parts": [
        {
          "fileName": "Z-Manga-Studio-kokoro-runtime-nvidia.zip.001",
          "sha256": "0a346c653338bb574d35ecd8fe04b448021f4de30b13ea2955feb8cd0d36983e",
          "sizeBytes": 1887436800
        },
        {
          "fileName": "Z-Manga-Studio-kokoro-runtime-nvidia.zip.002",
          "sha256": "3ddd1401d52d1d29cebfb6ccd9f9774f7a83c293969715b1b7de0ec911516aed",
          "sizeBytes": 1845458688
        }
      ],
      "runtimeId": "kokoro-fastapi",
      "runtimeVersion": "0.5.0",
      "source": {
        "packager": "scripts/package-kokoro-runtime.ps1",
        "releaseManifest": {